sentence1	sentence2	label
without the cooperation, there would be no victory of competition	take olympic games which is a form of competition for instance, it is hard to imagine how an athlete could win the game without the training of his or her coach, and the help of other professional staffs such as the people who take care of his diet, and those who are in charge of the medical care	high
competition makes the society more effective	the significance of competition is that how to become more excellence to gain the victory	low
through cooperation, children can learn about interpersonal skills which are significant in the future life of all students	during the process of cooperation, children can learn about how to listen to opinions of others, how to communicate with others, how to think comprehensively, and even how to compromise with other team members when conflicts occurred	high
it is crucial to keep one's identity	they need a connection back to their country as well as teach their children their value of origin	low
keeping the cultural traditions in the destination countries is tremendous important	children immigrated to a new country will face social troubles in school with new friends	low
sustaining the cultural values of immigrants is paramount essential	take australia for example, immigrants from varieties of nations have a day called multicultural day where people from each country prepare their food and traditional activities for displaying in the public venues	high
sustaining the cultural values of immigrants is paramount essential	many australians come this day to enjoy the shows, learn about the cultures and admire the diverse values	high
tourism has clearly improved lives in the tourist country	international tourism promotes many aspects of the destination country's economy in order to serve various demands of tourists	high
tourism has clearly improved lives in the tourist country	take cambodia for example, a large number of visitors coming to visit the angkowat ancient temple need services like restaurants, hotels, souvenir shops and other stores	high
tourism has clearly improved lives in the tourist country	these demands trigger related business in the surrounding settings which in turn create many jobs for local people improve infrastructure and living standard	high
international tourism can create negative impacts on the destination countries	take thailand for example, in the vietnam war, many american soldiers came to thailand for a break and involved in sexual and drug activities, these huge demands caused many local businesses opened and expanded, even illegally involved in under-age prostitutes to maximize their profits	high
tourism has threatened the nature environments	tourism increasingly create harms to the natural habitats of the destination appeals	low
many marine lives have been endangered, in the extremes part of the reef become uninhabitable for these marine species	as the australia's great barrier reef has shown, the billion visitors per annum has generated immense destruction to this nature wonder, namely breaking the corals caused by walking or throwing boat's anchors, dropping fuel and other sorts of pollutions	high
tourism has threatened the nature environments	many marine lives have been endangered, in the extremes part of the reef become uninhabitable for these marine species	high
one who has studied and lived overseas will become more eligible for the job than his/her peers	becoming successful in this study will give the student an edge in job market	low
studying at an overseas university gives individuals the opportunity to improve social skills by interacting and communicating with students from different origins and cultures	compared to the peers studying in the home country, it will be more likely for the one who is living overseas to be successful in adapting himself/herself into new environments and situations in life	high
students who study outside their countries can get a lot of experience living in a foreign country	living in a new country requires a great amount of flexibility and adaptability in one's character	low
they should be able to deal with the obstacles that they may encounter	students might face many challenges in the host country	low
students who study outside their countries can get a lot of experience living in a foreign country	they should be able to deal with the obstacles that they may encounter	low
the new academic experience that the students can obtain at the institution where they are pursuing their studies	they will meet new professors and new classmates which makes the academic experience different from that in their home country	low
most important is the cultural aspect of the experience	while living in a foreign country, students can learn a lot about the culture of that country	low
learning about others' cultures is so important	it makes us more open, and willing to accept different ideas and thoughts	low
the number of people reading newspapers may continue falling sharply, possibly leading to the close-downs of many in the coming time	from the economic aspect, buying newspapers appears to be a waste of money when the internet becomes available for every one	high
the print media has failed to keep its important role in the provision of information	as can be seen, these devices and machines are very common in all parts of the world, making it easier for people to read a number of things that newspapers can not provide in only some pages	high
the print media has failed to keep its important role in the provision of information	contrary to the past when people had to wait long hours to take a daily newspaper, nowadays, they can acquire latest news updated every second through their mobile phones or computers connected to the internet, everywhere and at anytime	high
the print media has failed to keep its important role in the provision of information	to obtain information, using the internet is quicker and more convenient than reading newspapers	high
newspapers' production will have to face environmentalists on its way to be alive	when taking environment into consideration, people must conceive that the more newspapers are published, the more trees are cut down	high
newspapers' production will have to face environmentalists on its way to be alive	this is simply the contributor to the deforestation which is happening all over the world today	high
government's big budget on universities may attract more excellent intellectuals and researchers into the country and enjoy a higher reputation worldwide	researches into humanities and art still need large amount of money	low
communication is very important	people have different habit in daily life, such as tidy the blanket in the morning	low
communication is very important	one might think this is a piece of cake while other would consider it as immense project	low
communication is very important	if one requested to move out just because his roommate do not tidy up the blanket in the morning might be crying over split milk	low
the policy that concentrates money on developing public transportation brings an advantageous impact on earth	if there are more good buses, trains, or subways, people are inclined to use less private vehicles, which decreases the amount of carbon released	high
governments have to turn people' attention on public vehicles to reduce cars and motorbikes	it is quiet clear that traffic congestion is a serious problem in many big cities	low
governments have to turn people' attention on public vehicles to reduce cars and motorbikes	there is the possibility that improving roads and highways does not seem to reach the major cause of traffic congestion	low
if the entire nation, from their school ages begin going for sports and try doing that everyday, eventually it may help to build healthy nation	the more we practice, the better we feel	low
when we practice outdoors and indoors sports, many aspects are getting clearer	when a person goes jogging everyday, eventually he can understand his own body through direct observation	low
when we practice outdoors and indoors sports, many aspects are getting clearer	almost all natural science discoveries were made by direct observation, which is a part of physical education	low
financial sustainability of a region mostly depends on how healthy the population is	the money invested into physical education program can save allocations into healthcare	high
putting physical activities in early steps of human development would finally lead to mentally healthy society	physically healthy people can contribute more both into economical and social development	high
putting physical activities in early steps of human development would finally lead to mentally healthy society	it ends up with financially competitive country	low
email can be count as one of the most beneficial results of modern technology	many years ago, peoples had to pay a great deal of money to post their letters, and their payements were related to the weight of their letters or boxes, and many accidents may cause problem that the post could not be delivered	low
another technological innovations which help people around the world is related to medical equipments	biomedical engineers could make a significant effect on increasing life expectancy the world	low
another technological innovations which help people around the world is related to medical equipments	in the past time doctors used pig heart's valve to implant, but the patient could not be alive more than 3 years after the replacement	high
another technological innovations which help people around the world is related to medical equipments	but now, biomedical engineers can make artificial heart valves which works well and doctors can implant them easily	high
with the advent of internet and online paying systems, you can do many thing at your home easily	another important aspect on technology is transferring money	low
when they come across a high-tech product like a cellphone, they will be obsessed with its mysterious functions and eager to know how it works	children are curious about everything around them	low
instead of interfering children's creativity, technology actually encourages children to learn and to create	when they come across a high-tech product like a cellphone, they will be obsessed with its mysterious functions and eager to know how it works	high
the diverse knowledge that children gained from different parts of the world, inspires children and encourage them to create new things	technology widen children's knowledge	low
the diverse knowledge that children gained from different parts of the world, inspires children and encourage them to create new things	in the past, children were only able to see things from one perspective	low
the diverse knowledge that children gained from different parts of the world, inspires children and encourage them to create new things	they will be able to learn about different cultures and different ways of thinking	high
technology may have negative effects on children	technology has made life too easy for most children	low
technology may have negative effects on children	with the development of technology, increasingly more young people become obsessed with high-tech products	high
students at schools and universities still learn much more from lessons with teachers	it is teachers that help them with obstacles in schooling	low
they can only input some key words and google it, and then there are numberless articles and websites related to it	students learn things easily	low
they contend that good television programs do teach students	discovery channel has many instructive episodes	low
they contend that good television programs do teach students	students have knowledge of others cultures, outer space etc	low
it is easy to point out many benefits users can get from email and text messaging, which answers to the question of their great popularity	such ways usually made people have troubles for the expensiveness, difficulties in far communication or emergency and the loss of information	low
it is easy to point out many benefits users can get from email and text messaging, which answers to the question of their great popularity	thanks to the function provided by email and text messaging (sms), it is cheaper and faster to transfer a lot of information, even to many people at the same time	high
it is easy to point out many benefits users can get from email and text messaging, which answers to the question of their great popularity	they are so convenient that the majority of population prefer to use them instead of some traditional ways	high
language in writing is not in its original form	people tend to use slangs and abbreviated words to shorten their writing and save more time in communicating for other activities	high
language in writing is not in its original form	people compose a message with only emoticons (the expressions by face created by service providers), which means there is no room for writing or typing texts	high
doing this various testing is a hazard of human's future and next generation	animals are friendly and vital for people	low
animals are friendly and vital for people	if there are no animals in the world, the balance of nature will broke down, and we, human, will die out as well	low
doing this various testing is a hazard of human's future and next generation	the animal experiments accelerate the vanishing of some categories of animals	low
it is indisputable that every new kind food or pill may be noxious, and scientists must do something to insure that the new invention benefits people instead of making people ill or even dying	it also have potentially harm for human's health without any testing	low
it is indisputable that every new kind food or pill may be noxious, and scientists must do something to insure that the new invention benefits people instead of making people ill or even dying	animal experiments have negative impact on the natural balance	low
in spite of enjoying watching television shows, it is really time consuming task	this is a problem that suffers all of us everyday	low
women have proved themselves in every field whether it is indoor or outdoor	nowadays women are working in home as well as in the sky	low
women have proved themselves in every field whether it is indoor or outdoor	they are acting as a good housewife and they are flying planes also	low
employers need male candidates for the heavy work such as repairing and installation of heavy machine	they want female candidates for soft natured work like counseling, teaching, designing etc	high
employers need male candidates for the heavy work such as repairing and installation of heavy machine	they prefer male staff for night shifts	low
the job selection criteria are pre decided	employers need male candidates for the heavy work such as repairing and installation of heavy machine	high
universities should accept equal numbers of students of both genders	women have proved themselves in every field whether it is indoor or outdoor	high
there will not be such worries when young adults live in their own home	parents will take care for them	low
if the young adults still study they will have to combine studying with working	they will not have money to pay for everything	low
another problem that the young adults may encounter is to find a co-tenant, who they do not like	living with such a person may be a huge problem for the young adults	low
living in their own houses will save the young adults a lot of money	parents will give their children money in order they to focus only on studying	low
if these companies were obliged to pay to clean up the air pollution, they would at least make an effort to reduce the amount of air pollution they cause	while these companies make a huge amount of money from their businesses, most of them are not considering to take precautions to reduce the amount of air pollution	high
by charging private individuals for causing air pollution, that will at least contribute to reduce the amount of the pollution	private individuals cause air pollution in several ways such as inessential use of cars and house heating	high
advertisers push the limits of creativity to dispose the consumers to purchase the product	we are mainly introduced to products through advertisements	low
the number of that product being sold will increases	the story delivers a desired call to drink that soft drink that people tend to drink when the weather is too hot	low
advertisement is the most effective way to create a well-known product	the more an advertisement of a product takes place in mass media, the more popular the product becomes	low
when a product is commonly used, it becomes trustworthy for the society, no matter what quality it is	it also has to be affordable for the consumer	low
they make the product preferable	advertisements have undeniable affects on the society about the product being advertised	low
it is not sufficient in itself	the product also should satisfy the needs of the consumers	low
universities provide not only skills for careers, but also academic knowledge for the human race, such as bio science, politics, and medicine	these academic values are necessary to the progress of the world	low
diverse experiences in the campus life can make the young generation more competently	there are a number of chances through internships, deeper discussion, independent life, and exchange scholarships	high
universities provide not only skills for careers, but also academic knowledge for the human race, such as bio science, politics, and medicine	diverse experiences in the campus life can make the young generation more competently	high
the mobile phone has become a dispensable multifunctional tools in people's daily life	not only used for communication, but it also functions as an internet browser, a music player, a personal organizer and so forth	high
several teenagers play games without rest, which leads to health depression	a typical example is the death of korean gamer, who had a non-stop playing for 3 days	high
even people who are not interested in online game can still be negatively affected by using computer too much	some social surveys have shown that a few children use computer for studying purpose, most of them are attracted by facebook, blog, etc. instead	high
it is true that some area are suffering the dire consequences caused by overdeveloping the industry, such as water pollution, overcrowded traffic and medical problems	in some industrial cities, a large proportion of the workers are suffering various breathing problems, such as asthma which can be caused by waste ashes and certain chemical substances	high
how to improve the disadvantages of building a factory would be more important than whether to build it	it is inevitable that there will be more factories built with the development of our society	low
a large factory can stimulate local economic growth and reduce the unemployment rate	the factory is not isolated, other industries and business will be quickly established, resulting in economic growth of local area	high
easy-to-cook foods sometimes could be dangerous for human's health	to make their food easier to prepare and taste delicious, almost every producer adds a wide range of artificial ingredients in to the food that is now purchased by most people	high
not cooking fresh food will also lead to the lack of nutrition	whereas some research has apparently demonstrated that prepared food is unable to support enough nutrients we need, especially for children who are growing up	high
if the developed countries are unwilling to share their successful experience in education, the developing countries will remain undeveloped, even though they gain a great deal of economic support	education is an essential part in development	low
these kind of ads will have negative effect to our children	youngsters might be tempted to buy cigarettes or alcohol and later to start consume it on a daily basis	low
advertising alcohol, cigarettes, goods and services with adult content should be prohibited	some countries take this issue seriously and advertising alcohol, cigarettes and materials with adult content is banned on those countries	high
these days, not only many businesses, but also governments have to rely on advertising	tourism makes up one-third of the czech republic's economy	high
there are many supporting conditions that help women balance housework and work	besides the gorvernment's policies on limited families and their husbands' sharing in the housework, many employers are willing to offer part-time jobs for women	high
it is no doubt that they play roles as a mother and as a wife better	working outside the house creates opportunities for married women to contact with the outer world, strengthen their character and show their capacity	high
it is no doubt that they play roles as a mother and as a wife better	these things in turn will make them more confident, independent	low
the air gets to be polluted and it causes respiratory disease of the local inhabitants	automobile exhaust and carbon dioxides emission have bad impacts on the air	low
the methods to reduce the number of automobiles and to control car ownership and use should be immediately planned and implemented	once we get into the traffic jam, it forces us to waste our time for a while	low
alternative forms which emit less carbon dioxides and gasses than automobiles are ideal	this system is that at the corner of each district, the rental bicycles are placed and the people can ride it to the other districts with a small fee	high
it is a better form to protect environment than automobile	bicycle expels neither carbon dioxides nor harmful gasses	low
alternative forms which emit less carbon dioxides and gasses than automobiles are ideal	it is a better form to protect environment than automobile	high
alternative forms of transportation and international laws to control automobiles ownership and use can work effectively	alternative forms which emit less carbon dioxides and gasses than automobiles are ideal	high
aiding help poor countries in this situation solve their economical problems and run their own business	poor counties suffer from shortage of basic materials and facilities to start businesses and make it richer	low
aiding help poor countries in this situation solve their economical problems and run their own business	to be out of poverty, it is fundamental to support basic industry related factors such as light, electricity, load, highways, natural resources, technology and buildings for companies	low
aiding help poor countries in this situation solve their economical problems and run their own business	republic of korea used to be the poorest country even compared to others in africa in 1960's	high
aiding help poor countries in this situation solve their economical problems and run their own business	now that it has became strong economy country aiding poor countries after 10 years of aid from other counties	high
the campaigns might include practical benefits	in globalized world, the economies of several countries are in a big network and must influence on each others	low
globalization contribute effectively to the global improvement of the world in many aspects	developing globalization, people can have more access to many natural resources of the world and it leads to increasing the pace of scientific and economic promotions of the entire world	high
schools provide lots of academic knowledge to students	students may learn professional skills, expand their understandings and gain experiences	low
they have more opprotunities to find a job and to be successful in the future	employer always prefer to hire an employee of high degree who have professional skills	low
it is not about the function or quality of the commodities themselves but really the promotion of the good feeling of possessing the product	huge cooperation hire celebrities as the face of their product	low
by casting famous singers in their television advertisement, motorcycles or clothes for example, sales increase significantly	youngsters, as the target consumers, love celebrities	low
it is not about the function or quality of the commodities themselves but really the promotion of the good feeling of possessing the product	by casting famous singers in their television advertisement, motorcycles or clothes for example, sales increase significantly	high
it plays and important role economically	advertisements can be falseful and exaggerated	low
they introduce new products, and provide various choices, not to mention they are often visually enjoyable	they aim to grab your attention	low
most violent crimes are related to the abuse of guns, especially in some countries where guns are available for people	in american, young adults and even juveniles can get access to guns, which leads to the tragedies of school gun shooting	high
the possession of guns can also raise the rates of suicide	in the us, firearms remain the most common method of suicide, accounting for about 50 per cent	high
the possession of guns can also raise the rates of suicide	there is an increasing trend of adolescent suicides and suicides among those age 75 and over	high
it really help to alleviate the tension	it is useful to ease tensions between nations	low
it really help to alleviate the tension	in fifa world cup 2010, the relation between north korea and south korea is dangerous for the warship sinking	low
it really help to alleviate the tension	the world suspected north korea of the aggressive action	low
it really help to alleviate the tension	due to this event north korea showed a friendship and enthuasism	low
an international sporting event also helps fans release patriotic emotions in a safe way	in olympic beijing 2008, chinese tried thier best to bring the world a spectacular image about their country	high
