sentence1	sentence2	label
an international sporting event also helps fans release patriotic emotions in a safe way	foreigners came here always received the support of friendly volunteers who were young students	low
an international sporting event also helps fans release patriotic emotions in a safe way	they were welcomed by each chinese hospitality, beauty in each cities	low
technical developments improve productivity, which help people to escape from daily chores, and invest more time and energy in studying and living a more meaningful life	we can talk with our friends online, no matter where we are and how far between us	low
most members of our society can benefit from the consequences of technical advancements, especially the poor people	the progress of material technology leads to the sharp fall of price of a great number of products	high
many facts about solar system can be discovered	if it was not for the space exploration, we would never know these facts	low
people can know more about the planet earth itself	by observing planet earth from outer space, people can find out ample things for example about the atmosphere of the planet earth	high
a great deal of sophisticated technology can be invented	as astronauts need to travel to outer space which does not have any oxygen to breathe in, scientists are compelled to do research on the oxygen tanks	high
having experienced in working environment during student time offers a distinct advantage when they apply for jobs after their graduation	it is undoubtedly certain that students can gain their practical experience by getting involved extra jobs	low
doing extra jobs helps student with money for their accommodation	high studying tuition, added with raising accommodation expenses are becoming a huge burden to students	low
students who take on a part time job are often more confident and independent than other ones	by constant communicating with other colleagues daily in a company environment where their new ideas can be raised without hesitation, then students' confidence could be significantly gained	high
students who take on a part time job are often more confident and independent than other ones	working conditions require students the independency in thinking, working, and solving problems, which is greatly helpful when the characteristic is applied to tackle subjects in their universities	high
companies save time and resources for searching new staffs and organizing an orientation	the younger generations can help them generate new ideas as the students are not bound to restricted workload and they tend to have greater imagination, which can be essentially helpful when they are making a new advertisement or slogan	high
companies save time and resources for searching new staffs and organizing an orientation	they can start looking for potential employees and begin the training	low
the internship, although without pay, can give them the experiences that money cannot buy	students might have little idea of the real challenges or the true situation when they enter the workforce after graduation	high
students can learn invaluable experiences through the period of time working for the institutions they are assigned to	the internship, although without pay, can give them the experiences that money cannot buy	high
a raise or a promotion can no doubt increase the morale in the working places	workers understand they have to work harder to meet the boss' expectations and to make themselves worthwhile	low
junior high school teachers have great responsibility not only for students' private lives as they are going through adolescence but also their school work	it is an important phase for them to study hard and get into the high school they want	low
junior high school teachers have great responsibility not only for students' private lives as they are going through adolescence but also their school work	if the teachers receive higher salaries, they will be willing to spend more extra time mentoring the youngsters rather than hoping they learn in cram schools and so forth, as this is what is happening in taiwan	high
a raise or a promotion can no doubt increase the morale in the working places	junior high school teachers have great responsibility not only for students' private lives as they are going through adolescence but also their school work	high
creating an enjoyable working environment is more realistic and essential if one wishes an increase in productivity and better employee performances	take google for example, the company offers recreation rooms and extra personal leaves for their workers to develop a more relaxing and supportive workforce	high
creating an enjoyable working environment is more realistic and essential if one wishes an increase in productivity and better employee performances	the employers can make sure the employees can actually focus and concentrate on their projects instead of thinking about their children or feeling pressured	high
it is clear that people can freely express their patriotic feelings during international sports events	when the football world cup was organised in south africa, its citizens filled up the stadiums, cheered and waved national flags to support their national team on the field	high
it is clear that people can freely express their patriotic feelings during international sports events	south african national and traditional songs were played in the streets throughout the night	high
it is clear that people can freely express their patriotic feelings during international sports events	this example demonstrates how people might take numerous elements from their roots and history to proudly display them while supporting their team	high
it would be a good implication by the government to generate electricity from other available sources	there is a lot of water shortage to generate electricity many countries still rely only on this source	low
it would be a good implication by the government to generate electricity from other available sources	if the government encourage the use of nuclear, solar or wind energy there might not be any problem in distributing the required amount electricity	high
the sources most widely used currently to generate power releases extensive amount of gases into the atmosphere which increases global warming	the use of nuclear energy as an alternative to the hydro-kinetic energy causes less atmospheric pollution	high
government money should be spent on publicly beneficial programs only	tax revenue is collected from those who works	low
this does not mean we should leave alone those who do need assistance	it is beneficial to the society as a whole when the jobless can make contribution again	low
it is, therefore, not necessary for a certain course or type of training to be offered to the students by a university, but instead, these must be made available when needed	universities are regarded as institutions where abundant educational resources gather	low
it is our responsibility to create a natural and safe environment for animals to live in	given the fact that human beings are responsible for the heavy pollution and severe damage to the natural habitats of many wild animals	low
educational institutions are able to optimize costs by increasing teacher-student ratios	thanks to the economical online-teaching, universities and colleges are able to offer grants for students who have outstanding academic achievements but are unable to attend schools because of financial constrains	high
these new forms of communication do bring a great deal of convenience to humankind	mobile phones and other tools of modern communication facilitate not only contact with friends and relatives in faraway places but also global business	low
these new forms of communication do bring a great deal of convenience to humankind	it is generally felt that the access to these tools of communication is available in every corner of the world	low
these new forms of communication do bring a great deal of convenience to humankind	with a mobile phone or a laptop, a person can talk or send messages online at a bus stop, in a corner shop or anywhere they could imagine	low
people who live in poverty are less likely to be benefited from modern communication technologies	anyone who aims to use these innovations have to not only pay for the appliances such as a mobile phone or a computer but also cover up costs for communication services	low
many university authorities provide music lessons for their students	it is obvious that music has a great power which can positively influence on human being and its psychology	low
many university authorities provide music lessons for their students	they live and study in a harmony with music	low
many university authorities provide music lessons for their students	students, who spend a great deal of their time studying different academic subjects should have an opportunity to cope with the stress gained during school time	low
many university authorities provide music lessons for their students	music can be a useful and interesting solution	low
many university authorities provide music lessons for their students	if musical activity involves many participants, there will be co-operation and developed team work in the group, which is, of course, beneficial in their future life	low
many university authorities provide music lessons for their students	the calm atmosphere in the class might be created	low
music and other entertaining subjects should be optional	it is clear that music can have many mentally enhancing effects on students	low
music and other entertaining subjects should be optional	demand is not for musically orientated students, but for academically developed employees	low
music and other entertaining subjects should be optional	music is the art which requires special attitude towards it	low
all professors and students need to have a modern and well-equipped library	a library is vital and strategical part of a university	low
all professors and students need to have a modern and well-equipped library	after internet, library plays an important role in research	low
there are good ways for sports activities to compensate their expenses, but it is very hard for libraries to find a good way for have an income	sport activities have a good income	low
investing in libraries has a long-time result	a library can buy a lot of new books or they can buy more computers	low
investing in libraries has a long-time result	most of the library facilities are stable and you can use them for a long time	low
the prevalent of english brings a great number of benefits for people	the innovation of plane and train solved the geographical barriers	low
english is a sophisticated language	it does not express every detail of life especially in asia countries, which have totally different linguistic system	low
the dominated status of english has destroyed culture diversity and many less-used languages become extinct	english is a sophisticated language	low
human being has driven many animals for their personal use such as, cows and other milch animals for yielding milk from them	they are kept for security purposes in houses	low
many farmers and owners exploit animals beyond their limits	cows are often injected by oxytocin, a hormone which is used to forcibly increase lactation	high
many farmers and owners exploit animals beyond their limits	and above all pleasure hunting of defenseless animals	low
people who watch exhibitions on tv or internet at home, save the time and money on the road, which is increasingly significant particularly to people in modern society	technology indeed simplifies people's life all the time	low
in accordance with recent research, experts suggest the lifestyle of individuals in modern society is unhealthy	they lack of physical exercise and face-to-face communication	low
these buildings will not disappear unless people abandon their culture	museums and art galleries preserve some culture heritages	low
the benefits of teaching students different units are easily recognized	still many teenagers cannot enjoy the variation of the curriculum, instead, they feel more stressful with so much homework and exams to be done	low
this education model can cultivate more talents who specialized in different areas and increase studying effectiveness	under such target-oriented education environment, teenagers may be hard to regret their original choice and change their specialized field in their further study	low
this education model can cultivate more talents who specialized in different areas and increase studying effectiveness	the dullness of course may deeply influence their passion on study	low
studying abroad is easy and becomes hot among youngsters	in my country, english is a required course from elementary school	low
no one can deny the huge benefits of the trend that english is being accepted universally	communication between countries and cultures become convenient	low
researchers, especially those who work on high-tech, would have wider range of references if they are good at english	taking it industry for an example, top technical science is published in english	low
they have no choice but choosing english as a second language	it's neither to get a translated version of these articles, nor to always have a translator besides	low
it helps to raise issues and criticize the wrong doings of the governments	bangladeshi writer taslima nasrin was accused of acting against the government, just because she raised a social issue	high
it helps to raise issues and criticize the wrong doings of the governments	this type of approach is a hurdle in promoting creative minds	low
co-operation is essential for teamwork	educational systems emphasize on encouraging co-operative approach in children	low
co-operation helps to understand other's perspective and learn by their mistakes	it helps to identify one's strengths and weaknesses as compared to others	low
lions hunt in a team	it is only due to their teamwork that they are able to catch a prey and make task easy	low
competition helps in improvement and evolution	competition has helped the development of science and technology	low
capital punishment protects the society from hardcore criminals	"capital punishment is given only in the ""rarest of the rare"" cases"	low
they can make mistakes which can sometimes affect an innocent, circumstantially marred criminals	the jury giving the verdict are also humans	low
working or traveling for some time, after high school, can help them to find their field of interest	it will also help them to learn professional setup by working	low
working or traveling for some time, after high school, can help them to find their field of interest	financially, students can save a little money to support their university education by doing a job	low
working or traveling for some time, after high school, can help them to find their field of interest	some students even utilize this time for preparation of their desired university course	low
a break can disturb the focus of students and prove detrimental	students can also indulge in smoking or drinking during this time	low
a break can disturb the focus of students and prove detrimental	it varies from individual to individual, how they utilize that period	low
computers provide speed, increase efficiency, accuracy, precision, help to increase productivity and other countless benefits are provided by it	in the modern world, computers are used everywhere	low
computers have made humans over-dependent	virus programs, privacy breach, leak of confidential documents, cyber attacks, identity theft, frauds etc. are some of its demerits, from a countless list	high
computers have made humans over-dependent	they have even invaded mental health of humans, for example, fad (facebook addiction disorder - excessive use of social networking website facebook)	high
computers have made humans over-dependent	computers expose children to vulgar materials	low
computers provide speed, increase efficiency, accuracy, precision, help to increase productivity and other countless benefits are provided by it	computers have made human life more easy, convenient and lightning fast	high
females should be given equal opportunities as males	right to education is a basic human right of both, males and females	low
females should be given equal opportunities as males	the whole world aims for women empowerment	low
it helps them how to behave and cooperate and work together	females studying in girl's colleges are too shy to face boys	low
some male chauvinists think that women are incapable in particular fields, like maths, mechanical engineering, defense etc	this kind of gender biased approach is detrimental for the development of the society	low
people nowadays just spend one hour to prepare a meal instead of two, even three hours like in the last 10 years	with the development of science and technology, more advanced kitchen facilities, such as the modern microwaves or the advanced pressure cookers, have been created and invented to help people prepare and cook food in a very short time	high
it is certain that spending less time on cooking will be the main trend in near future	people nowadays just spend one hour to prepare a meal instead of two, even three hours like in the last 10 years	high
most of young people prefer to have meals at restaurants	they want to invest more time in their work or study to improve themselves	low
they find hard to have time to prepare and cook a meal	89% of people have come to think that, since they have been put in the situation which is filled with competitions and pressures, they have to use a lot of time to work hard, to update themselves, to acquire all kinds of skills and so on	high
most of young people prefer to have meals at restaurants	they find hard to have time to prepare and cook a meal	low
it is quite easy to have a nutritious meal with guaranteed quality, but do not waste a lot of time	along with the high living standard, requirements of quality products in almost restaurants, nowadays, are under severe control and supervision by appropriate authorities	high
it is quite easy to have a nutritious meal with guaranteed quality, but do not waste a lot of time	health and life of eaters is assured	low
investing much time in cooking food will guarantee nutrition as well as quality of food for their family	it is quite easy to have a nutritious meal with guaranteed quality, but do not waste a lot of time	low
one primary merit of traditional games is that they foster children's communication skills	communicating with a variety of people will not be an issue for these children any more	low
traditional games are still indispensible in children's learning process, even much more essential than modern games, especially in modern society	one primary merit of traditional games is that they foster children's communication skills	low
it is the educational functions traditional games hold that keep them alive today	these traditional games were elaborately devised by educators and have been proven effective in improving children's skills on different aspects in previous teaching practices	high
it is the educational functions traditional games hold that keep them alive today	there is a risk that children may be exposed to unhealthy contents, such as violence or pornography, arranged in the games by such companies to secure financial survival	low
taking care of thousands of citizens who suffer from disease or illiteracy is more urgent and pragmatic than building theaters or sports stadiums	an uneducated person may barely appreciate musicals, whereas a physical damaged person, resulting from the lack of medical treatment, may no longer participate in any sports games	low
entertaining facilities such as cinemas, theaters and sports stadiums are mostly profit-oriented	the competition among each of these facilities is an inevitable part of the free market, which should not be interfered by government	low
entertaining facilities such as cinemas, theaters and sports stadiums are mostly profit-oriented	the establishment of medical facilities or educational institutes is aimed to improve the health or education standard rather than earning profits, which deserves more funds from government	low
sectors such as medical care and education deserve more governmental support	it is a bit inappropriate to use the majority of citizens' tax funds to meet a minority of people's needs	high
in terms of time and space, technology makes it more efficient and effective to promote the traditional skills and ways of life	with the access to the internet, one of the greatest innovations in modern society, humankind can acquire the traditional techniques displayed online anytime, anywhere	low
technology enriches the way of displaying traditional cultural heritage, making it more vivid and appealing	many tourists around the world marveled at the perfect synthesis of the modern technology and the traditional culture	high
one of the major concerns against freeing artists' creation derives from the fear of social misleading which would destabilize the society	art inevitably involves imagination, exaggeration and sometimes is purely fabricated; regardless of whether the work of art is based on truth or not, it is the public's authority to determine how to interpret its meaning	high
restrictions on exposure to adolescents should apply	in the case of adults being the audience, there's really nothing to hide these negative things objectively exist on this planet and it is impossible for adults to be brain-washed only because of some pieces of creative art	high
excessive violence would offer misleading information to the public and exert detrimental influence to the society as well	it is recently reported in the news that a seventeen-year-old boy killed all his family members, one sister and two parents out of hatred and jealousy	low
excessive violence would offer misleading information to the public and exert detrimental influence to the society as well	violence, as one of the facts in the real world, certainly has to be reported	low
women nowadays are much more active, they may be successful businessmen, they join the political world, they become scientists and so on	gone are the days when women could do nothing rather than stick to boring house work and take care of children	low
such changes do lead to some negative results like an upward trend in divorce rate	children might enjoy less care from parents as they are both busy with their work	low
it seems not easy to increase petrol price instantly	governments have a macro-economic perspective to control price in various areas according to social demands	low
it seems not easy to increase petrol price instantly	pollutions are not just caused by the burning of oil, chemical pollutants, extra lights, also constitute considerable amount of pollution	low
it seems not easy to increase petrol price instantly	the improvements of work efficiency also attribute to the speed-up of working pace, resulting in traffic jams during rush-hours	low
it seems not easy to increase petrol price instantly	price control institution has been used in plenty of social areas, for example, in the farming products and in the real estate area	low
publicizing brand image or a particular product of mass media could boost sales for companies	it could simulate household spending and therefore promote the economic development of the whole country	low
exercise play a crucial role in ameliorating physical health	any kinds of sports, such as jogging, swimming, or playing basketball, can effectively facilitate human respiration and circulation system	high
exercise play a crucial role in ameliorating physical health	these sports can also strengthen muscles and lessen surplus adipose tissues in human body	high
exercise play a crucial role in ameliorating physical health	the latter one is of particular importance because nowadays more and more people are suffer from obesity	low
this hormone can delight one's mind, creating positive feelings	when people exercise, the neuron cells in the brain release a chemical compound named dopamine	high
written words are also vital in order to spread across certain messages	academic textbooks these days are laden with words besides pictures to guide the readers to comprehend better	high
statistics show a slight reduction in the number of smokers, indicating that they realize the effects of the negative habit	nowadays horrendous images are displayed on the cigarette boxes to illustrate the consequences of smoking	high
pictures can influence the way people think	statistics show a slight reduction in the number of smokers, indicating that they realize the effects of the negative habit	high
governments should spend money on keeping and preserving these things for the rich diversity of cultures which make our world more interesting	it helps people distinguish between nations and even regions in a country	low
there are some drawbacks from saving minority languages	there are a few people, particularly the youngsters, do not pay attention on collecting and studying those	low
there are some drawbacks from saving minority languages	the preservations need a long time to gather, restore all information as well as train in the educational centre	low
art, to some extent, serve a valuable function about enriching one's daily lives	it could bring release one's heavy burden of study pressure and refresh human bodies through a hard day from work	low
such people might fail to get cured in time, thus influencing their working efficiency, which would destabilize the production of the industry	if citizens had no access to health care and education, their physical health and psychological soundness would be at risk	low
